2012-11-14 11:45:11 -0500, alex, Merge
2012-11-14 11:43:13 -0500, alex, MKTAXI-506
2012-11-14 11:06:16 -0500, matthieu, Merge
2012-11-14 11:05:39 -0500, matthieu, fix android compilatin problem
2012-11-14 11:01:04 -0500, matthieu, Merge
2012-11-14 10:58:48 -0500, matthieu, update android version
2012-11-14 10:54:25 -0500, matthieu, Update AssemblyInfo to 1.2
2012-11-14 11:02:34 -0500, vincent, [iOS] Changed version number to 1.2.0
2012-11-14 10:31:18 -0500, vincent, Removed unsused usings
2012-11-14 10:22:44 -0500, vincent, Merge with default
2012-11-14 10:21:48 -0500, vincent, Set API date format back to ISO8601
2012-11-14 10:21:24 -0500, vincent, Fixed issue with addons icon colors in Admin (Manage Rates)
2012-11-14 09:19:47 -0500, matthieu, MKTAXI-494 update website files
2012-11-14 09:07:57 -0500, matthieu, MKTAXI-494 change phone to mobile in others screens as well
2012-11-13 18:46:41 -0500, vincent, Changed some Tariffs labels in admin
2012-11-13 18:28:39 -0500, vincent, Merge with MKTAXI-RATINGS
2012-11-13 18:26:55 -0500, vincent, Merge with default
2012-11-13 18:26:45 -0500, vincent, Fixed build
2012-11-13 18:18:01 -0500, vincent, Refactoring - Removed usage of AppContext.LastOrder
2012-11-13 16:23:08 -0500, vincent, Small refactoring in DateTimePickerActivity
2012-11-13 16:20:07 -0500, vincent, Removed unused usings
2012-11-13 16:18:22 -0500, vincent, Removed unused usings
2012-11-13 16:17:38 -0500, vincent, Merge with default
2012-11-13 16:17:18 -0500, vincent, Moved ConfirmOrder and CompleteOrder to ViewModel
2012-11-13 14:59:29 -0500, vincent, Merge with default
2012-11-13 14:59:00 -0500, vincent, Refactoring of BookViewModel for Rebook
2012-11-13 16:35:08 -0500, alex, Close MKTAXI-394 branch
2012-11-13 16:34:33 -0500, alex, Merge with MKTAXI-394
2012-11-13 16:33:42 -0500, alex, Merge with MKTAXI-394
2012-11-13 16:29:29 -0500, alex, MKTAXI-394
2012-11-13 16:11:36 -0500, matthieu, MKTAXI-492 add setting for company settings
2012-11-13 14:50:32 -0500, matthieu, upgrade mobile app version
2012-11-13 13:47:50 -0500, matthieu, Merge with HotFix-Labels
2012-11-13 13:44:16 -0500, matthieu, Merge with HotFix-Labels
2012-11-13 12:19:18 -0500, matthieu, update icons and add the 1024 ones
2012-11-13 11:11:57 -0500, matthieu, Merge
2012-11-13 11:11:26 -0500, matthieu, MKTAXI-491 remove call to IBS web service in create order for reference data, use the local service
2012-11-13 10:30:07 -0500, vincent, added missing file to csproj
2012-11-12 18:44:19 -0500, vincent, Merge with default
2012-11-12 18:43:48 -0500, vincent, Removed dead code
2012-11-12 18:38:53 -0500, vincent, CancelOrder button is now MVVM
2012-11-12 18:04:46 -0500, vincent, Started refactoring of HistoryDetailActivity to use ViewModel
2012-11-12 18:25:24 -0500, alex, MKTAXI-505
2012-11-12 18:08:43 -0500, alex, Automated merge with https://bitbucket.org/apcurium/mk-taxi
2012-11-12 18:08:14 -0500, alex, MKTAXI-503 MKTAXI-508
2012-11-12 17:30:35 -0500, alex, MKTAXI-509
2012-11-12 17:11:44 -0500, alex, Automated merge with https://bitbucket.org/apcurium/mk-taxi
2012-11-12 17:09:38 -0500, alex, Refactoring Confirmation to use mmvm
2012-11-12 17:42:21 -0500, vincent, MKTAXI-511: [Web]  incorrect location icon in address fields (Booking View)
2012-11-12 17:33:17 -0500, vincent, MKTAXI-281: CreateAccount request is not validated
2012-11-12 17:03:59 -0500, vincent, MKTAXI-461: Added ability to change some IBS settings in Admin
2012-11-12 17:02:45 -0500, matthieu, Merge
2012-11-12 17:01:19 -0500, matthieu, fix log4net  rollingfile settings
2012-11-12 16:59:24 -0500, vincent, Merge
2012-11-12 16:46:43 -0500, vincent, MKTAXI-500: [Web] Multiple Cancel Order requests issue
2012-11-12 16:11:08 -0500, vincent, MKTAXI-501: [Web] Out of zone message is not displayed
2012-11-12 15:34:22 -0500, vincent, Fixed Android build
2012-11-12 15:27:05 -0500, vincent, Merge with default
2012-11-12 16:16:44 -0500, matthieu, remove email.noreply from company template
2012-11-12 16:05:00 -0500, matthieu, MKTAXI-507 add payload in error log with command/event json
2012-11-12 15:40:32 -0500, matthieu, Merge
2012-11-12 15:38:18 -0500, matthieu, MKTAXI-502 remove prebuild event for bat file in localizationtool directory
2012-11-12 15:25:06 -0500, vincent, Merge
2012-11-12 15:24:42 -0500, vincent, Fixed android build
2012-11-12 15:22:17 -0500, Florent, Fix delete in history order details
2012-11-12 14:56:16 -0500, matthieu, Merge
2012-11-12 14:55:23 -0500, matthieu, MKTAXI-502 fix android resource generation for mac osx
2012-11-12 14:08:26 -0500, matthieu, MKTAXI-496 MKTAXI-498 dans le fichier master
2012-11-12 13:55:39 -0500, vincent, Merge
2012-11-12 13:54:15 -0500, vincent, Fixed some issues in HistoryDetailView (Too many requests)
2012-11-12 13:48:23 -0500, matthieu, Merge
2012-11-12 13:47:20 -0500, matthieu, add date ticks in the name og the deployment for wwww directory
2012-11-12 12:43:35 -0500, matthieu, MKTAXI-495 building name was duplicated on client and server
2012-11-12 12:06:24 -0500, matthieu, MKTAXI-498 change phone number to mobile
2012-11-12 11:50:50 -0500, matthieu, MKTAXI-496 label ring code to entry code
2012-11-12 12:46:03 -0500, Florent, fix merge error
2012-11-12 12:43:20 -0500, Florent, Merge with default
2012-11-12 12:37:17 -0500, Florent, Fix ui and some issues for ratigs orders
2012-11-12 12:38:25 -0500, alex, Reload settings when key not available
2012-11-12 11:45:54 -0500, alex, MKTAXI-497 + ui threading issues
2012-11-12 11:36:37 -0500, alex, MKTAXI-497 + ui threading issues
2012-11-12 10:49:29 -0500, vincent, Merge
2012-11-12 10:16:54 -0500, vincent, MKTAXI-499: Fixed "Generic title" bug
2012-11-12 09:42:46 -0500, vincent, Merge
2012-11-12 08:51:36 -0500, matthieu, order deployment job by date
2012-11-09 19:11:55 -0500, vincent, Disable changing rating when trip was already rated
2012-11-09 17:54:55 -0500, vincent, Display "Rate trip" or "View rating" if user has rated the trip
2012-11-09 16:58:21 -0500, vincent, Merge
2012-11-09 16:57:50 -0500, vincent, Refactoring of history views to MVVM
2012-11-09 15:40:18 -0500, vincent, Merge
2012-11-09 15:39:53 -0500, vincent, Navigate to RateTrip from order history
2012-11-09 14:56:27 -0500, vincent, Converted BookingStatusView to MVVM
2012-11-09 16:51:57 -0500, Florent, Merge
2012-11-09 16:49:50 -0500, Florent, MKT-373 : remove text area for rating and set the rate type name in the view model
2012-11-09 15:36:29 -0500, alex, Merge
2012-11-09 15:36:09 -0500, alex, no message
2012-11-09 15:33:19 -0500, alex, Fix navigation issue ( hidden navigation bar )
2012-11-09 12:02:33 -0500, alex, Merge
2012-11-09 12:01:43 -0500, alex, updated ignore file
2012-11-09 11:58:23 -0500, alex, Merge
2012-11-09 11:57:34 -0500, alex, no message
2012-11-09 11:56:27 -0500, alex, no message
2012-11-09 08:53:57 -0500, alex, Updated ignore file
2012-11-09 12:58:20 -0500, matthieu, add copy of binaries in package folder
2012-11-09 12:35:09 -0500, matthieu, delete script and using msbuild API
2012-11-09 11:57:15 -0500, vincent, Added background colour to BookRatingView + localization
2012-11-09 10:16:48 -0500, vincent, Removed Notes field
2012-11-09 11:25:43 -0500, matthieu, add tampa settings
2012-11-09 11:09:39 -0500, matthieu, change folder
2012-11-09 10:44:49 -0500, matthieu, sort deploy settings
2012-11-09 10:44:39 -0500, matthieu, Rename config folder for taxihaildemo mobile app
2012-11-09 09:52:19 -0500, matthieu, change log4net settings for file
2012-11-09 09:15:22 -0500, matthieu, fix column width, lognet file settings
2012-11-09 08:35:16 -0500, alex, Modify ignore file
2012-11-08 17:50:53 -0500, vincent, Merge
2012-11-08 17:49:41 -0500, vincent, Successfully submitted rating
2012-11-08 16:56:42 -0500, vincent, Integration of RatingTableCell with RatingModel
2012-11-08 13:55:54 -0500, vincent, Managed to create a simple custom TableViewCell for rating types
2012-11-08 16:37:04 -0500, matthieu, sort ibs and comnpaies by name
2012-11-08 16:35:12 -0500, matthieu, Merge
2012-11-08 16:34:56 -0500, matthieu, add date to deployment job, clean UI
2012-11-08 16:04:13 -0500, matthieu, delete api file if already exists
2012-11-08 15:39:41 -0500, matthieu, Automated merge with https://bitbucket.org/apcurium/mk-taxi
2012-11-08 15:39:30 -0500, matthieu, add details for log error
2012-11-08 15:36:36 -0500, matthieu, fix prebuild event andrdoid for macosx
2012-11-08 15:23:21 -0500, matthieu, fix VS solution for Android
2012-11-08 14:34:02 -0500, Florent, Fix UI
2012-11-08 14:28:05 -0500, matthieu, fix missing files buld action
2012-11-08 14:09:31 -0500, matthieu, fix missing files 2
2012-11-08 13:57:54 -0500, Florent, MKT-373 : add settings to enable rate and fix ui
2012-11-08 09:49:46 -0500, Florent, Merge
2012-11-08 09:47:58 -0500, Florent, fix navigation link
2012-11-08 13:56:02 -0500, matthieu, Fix missing files in web project
2012-11-08 13:41:49 -0500, matthieu, fix update on database with settings (atlanta)
2012-11-08 12:14:53 -0500, matthieu, settings for boston cab
2012-11-08 09:17:57 -0500, matthieu, Add settings victoria
2012-11-08 09:16:30 -0500, matthieu, Add settings and config for tampa, boston cab and victoria
2012-11-08 08:44:57 -0500, matthieu, add theme for worcester
2012-11-08 08:43:09 -0500, matthieu, add theme for worcester
2012-11-07 17:48:20 -0500, vincent, Adding missing files
2012-11-07 16:35:49 -0500, vincent, Created BookRatingView
2012-11-07 14:06:07 -0500, vincent, Fixed iOS app build
2012-11-07 17:14:52 -0500, alex, Added Worcester Config
2012-11-07 15:43:17 -0500, alex, Added client build variable in release mode
2012-11-07 13:25:49 -0500, vincent, Merge with default
2012-11-07 13:10:41 -0500, vincent, Started refactoring of ResourceManager to handle multiple source files
2012-11-07 11:29:47 -0500, vincent, Close MKTAXI-434 branch
2012-11-07 11:28:21 -0500, vincent, Close MKTAXI-435 branch
2012-11-07 12:52:19 -0500, Florent, MKT-470 : end of user can rate at the end of an order ( mvvm + android )
2012-11-06 17:24:06 -0500, Florent, MKT-470 : finish user can rate at the end of an order (mvvm)
2012-11-07 11:49:03 -0500, alex, Updated Des MOines Logo
2012-11-07 11:13:04 -0500, vincent, Merge
2012-11-07 10:58:14 -0500, vincent, Merge
2012-11-07 10:53:40 -0500, vincent, Updated prebuilt command in iOS project
2012-11-07 10:36:10 -0500, matthieu, Merge
2012-11-07 10:17:21 -0500, alex, Merge
2012-11-07 10:16:58 -0500, alex, Display pickup date time instead of created date time
2012-11-06 16:33:44 -0500, alex, Close Hotfix-Timezone branch
2012-11-06 16:30:54 -0500, alex, Merge
2012-11-06 16:29:53 -0500, alex, Wrong date displayed in order list.
2012-11-06 16:16:43 -0500, alex, Wrong date displayed in history list.  Changed to pickup date
2012-11-06 16:06:24 -0500, alex, Fix merge issue
2012-11-06 16:03:55 -0500, alex, Merge with Hotfix-Timezone
2012-11-06 16:01:35 -0500, alex, Merge with Hotfix-Timezone
2012-11-06 16:01:09 -0500, alex, Fixes issues when using the application in a diffrent timezone.
2012-11-07 10:09:38 -0500, vincent, Moved guard clause to prebuild command instead of PropertyGroup Condition
2012-11-06 18:07:11 -0500, vincent, Fixed added guarding clause for PreBuildEvent in Android project
2012-11-06 17:47:28 -0500, vincent, Added more command line options to localization tool
Tested with android project
2012-11-06 16:45:20 -0500, vincent, Added PreBuild location command in iOS proj
2012-11-06 16:28:50 -0500, vincent, Merge
2012-11-06 16:27:42 -0500, vincent, Merge
2012-11-06 16:27:00 -0500, vincent, Merge
2012-11-06 16:25:04 -0500, vincent, Fixed iOS build
2012-11-06 16:15:59 -0500, vincent, Fixed build on Android
2012-11-06 15:27:15 -0500, vincent, MKTAXI-435: Added command line options for LocalizationTool
2012-11-06 13:39:37 -0500, Florent, MKT-471 : User can see rate he has attributed on order details page
MKT-470 : Add button when order is done to rate order
2012-11-05 17:16:58 -0500, Florent, MVVM for order history detail and list.
Can navigate from history detail to order rating.
if order is incomplete, user cannot rate order
if order is already rated, user can only view order.
2012-11-02 16:22:40 -0400, Florent, MKT-470, MKT-475 : Create MVVM for rate an order
2012-11-06 12:11:17 -0500, vincent, MKTAXI-485: No error message when signing up with same email address
2012-11-06 11:56:54 -0500, vincent, Fixed jquery selector bug with user account tabs
2012-11-06 11:30:18 -0500, vincent, Fixed color issues with Atlanta theme
2012-11-06 11:13:07 -0500, vincent, Fixed icon color issues with Atlanta theme
2012-11-06 10:23:23 -0500, vincent, Merge with hotfix-ie8
2012-11-06 10:20:48 -0500, vincent, Merge with hotfix-ie8
2012-11-06 10:20:03 -0500, vincent, Fixed regression: Do not show validation label if no message
2012-11-06 10:09:21 -0500, vincent, Fixed Http cache issue with OrderStatusService
2012-11-05 18:56:07 -0500, vincent, Merge
2012-11-05 18:49:37 -0500, vincent, Created No-Cache attribute for CurrentAccountService
2012-11-05 17:25:56 -0500, vincent, Fixed user acount tabs background color issue in IE8
2012-11-05 18:30:53 -0500, alex, no message
2012-11-05 18:29:50 -0500, alex, iOS build
2012-11-05 18:02:11 -0500, Maxime, Merge
2012-11-05 17:58:46 -0500, Maxime, MKTAXI-444 : Create Console to easily update client resource files
2012-11-05 17:06:23 -0500, alex, Automated merge with https://bitbucket.org/apcurium/mk-taxi
2012-11-05 17:05:57 -0500, alex, Update to service stack
2012-10-25 07:35:10 -0400, alex, Update to ignore file
2012-11-05 16:56:55 -0500, vincent, Merge
2012-11-05 16:56:22 -0500, vincent, MKTAXI-379: [Android] Gray button design improvements
2012-11-05 16:37:30 -0500, vincent, MKTAXI-379: [Android] Gray button design improvements
2012-11-05 16:33:01 -0500, vincent, MKTAXI-379: [Android] Green button pressed state corrections
2012-11-05 16:23:11 -0500, vincent, MKTAXI-379: [Android] Red button design improvements
2012-11-05 15:58:55 -0500, vincent, MKTAXI-379: [Android] Fixed green button pressed state
2012-11-05 15:58:23 -0500, vincent, MKTAXI-379: [Android] excluded unused files
2012-11-05 15:52:19 -0500, vincent, MKTAXI-379: [Android] Booking screen buttons redesign
2012-11-05 13:24:42 -0500, vincent, Merge
2012-11-05 13:14:18 -0500, vincent, Merge
2012-11-05 13:14:10 -0500, vincent, MKTAXI-379: fixed button border wisth issue
2012-11-05 16:25:03 -0500, Maxime, MKTAXI-444 : Create Master Resx file from iOS & Android Localizations + Tools
2012-11-05 15:38:36 -0500, alex, Version release of Taxiworld
2012-11-05 13:20:06 -0500, Maxime, MKTAXI-444 : Added NuGet package management
2012-11-05 13:10:56 -0500, Maxime, Merge
2012-11-05 12:06:31 -0500, Maxime, MKTAXI-444 : iOSResourceFileHandler & AndroidResourceFileHandler - Save + Create Resx file
2012-11-05 09:30:23 -0500, vincent, Merge
2012-11-05 09:29:42 -0500, vincent, Fixed bug with Controllers initialize method being called twice
2012-11-05 09:08:04 -0500, vincent, MKTAXI-481: reordered admin menu items
2012-11-05 08:59:42 -0500, vincent, Close MKTAXI-484 branch
2012-11-05 09:02:56 -0500, matthieu, add SMTP settings for smtpcorp
2012-11-04 19:04:40 -0500, vincent, Merge with MKTAXI-484
2012-11-04 19:04:14 -0500, vincent, Merge with default
2012-11-04 19:03:45 -0500, vincent, End of admin controllers refactoring
2012-11-04 18:24:51 -0500, vincent, Rfactoring of default addresses admin section
2012-11-04 18:12:34 -0500, vincent, Refactoring of Popular addresses admin section (fixes)
2012-11-02 19:02:44 -0400, vincent, Refactoring of Popular addresses admin section
2012-11-02 18:09:11 -0400, vincent, Refactoring of default favorite addresses admin section
2012-11-02 17:32:38 -0400, Maxime, MKTAXI-444 : iOSResourceFileHandler & AndroidResourceFileHandler
2012-11-02 16:23:11 -0400, Maxime, Merge
2012-11-02 16:18:15 -0400, Maxime, MKTAXI-444 : Setup structure for localization refactorings
2012-11-02 15:32:53 -0400, vincent, removed return type from method returning nothing
2012-11-02 15:19:23 -0400, vincent, Fixed failing Web Integration Test
2012-11-02 14:34:42 -0400, Maxime, Merge
2012-11-02 14:31:35 -0400, Maxime, MKTAXI-434 : Merge avec default
2012-11-02 14:00:59 -0400, Maxime, Merge with MKTAXI-434
2012-11-02 14:19:51 -0400, vincent, Close hotfix-ie8 branch
2012-11-02 14:18:53 -0400, vincent, Merge with hotfix-ie8
2012-11-02 14:10:48 -0400, vincent, Merge
2012-11-02 13:43:40 -0400, vincent, Merge with hotfix-ie8
2012-11-02 13:41:15 -0400, vincent, removed header gradient for IE9 and lower versions
2012-11-02 12:08:05 -0400, vincent, fixed bug with booking status refresh in ie8
2012-11-02 10:50:47 -0400, vincent, Fixed IE8 bug in jQuery Validate plugin
2012-11-02 09:51:04 -0400, vincent, Fixed jslint warning with regex
2012-11-02 09:41:59 -0400, vincent, Fixed well background problem in IE8
2012-11-01 18:07:41 -0400, vincent, MKTAXI-473: Increase ReferenceData cache expiration to INFINITY
2012-11-02 13:41:28 -0400, Maxime, MKTAXI-474 : Refresh cache ReferenceData after change
2012-11-02 11:51:25 -0400, Maxime, MKTAXI-434 : Localization added for Manage Settings
2012-11-02 11:45:49 -0400, Maxime, MKTAXI-434 : UI Modification to support AddOrUpdateSettings - finished
2012-11-01 18:17:39 -0400, Maxime, MKTAXI-434 : UI Modification to support AddOrUpdateAppSettings - not finished
2012-11-02 11:21:56 -0400, alex, Update to Style Transportation Graphics
2012-11-02 10:47:42 -0400, alex, Merge
2012-11-02 10:47:14 -0400, alex, Started localization project
2012-11-01 17:02:28 -0400, alex, Merge
2012-11-01 17:01:31 -0400, alex, Add popular address loader
2012-11-01 17:56:33 -0400, vincent, fixed deployment bug with settings
2012-11-01 17:39:39 -0400, matthieu, fix copy apk
2012-11-01 16:48:39 -0400, matthieu, add mobile settings import
2012-11-01 16:46:12 -0400, vincent, MKTAXI-434: Update settings in batch when changing IBS exclusions
2012-11-01 15:57:35 -0400, vincent, Close MKTAXI-432 branch
2012-11-01 16:33:54 -0400, matthieu, Close DeployMobile branch
2012-11-01 16:31:48 -0400, matthieu, Merge DeployMobile branch
2012-11-01 16:30:34 -0400, matthieu, add android deploy for mac
2012-11-01 16:17:09 -0400, matthieu, add VS2010 mention in sln file for monodroid build
2012-11-01 16:05:06 -0400, matthieu, remove VS2012 mention in sln file for monodroid build
2012-11-01 15:55:52 -0400, Maxime, MKTAXI-434 : Refactoring des settings et IBS exclusions pour AddOrUpdateSettings
2012-11-01 15:30:35 -0400, matthieu, add upload of Android
2012-11-01 15:28:15 -0400, vincent, Close MKTAXI-380 branch
2012-11-01 15:27:07 -0400, vincent, Merge
2012-11-01 15:26:40 -0400, vincent, MKTAXI-380: Added "Next day" warning when tariff end time is the next day
2012-11-01 15:00:48 -0400, vincent, MKTAXI-380: Customize Edit Tariff form for default tariff
2012-11-01 14:21:02 -0400, vincent, MKTAXI-380: Refactoring of tariff terms (kilometric Rate, Passenger Rate,
Margin of error)
2012-11-01 13:53:42 -0400, vincent, MKTAXI-380: Refactoring of tariff terms (kilometric Rate, Passenger Rate,
Margin of error)
2012-11-01 13:48:03 -0400, vincent, MKTAXI-380: BEtter defautl startTime and EndTime for tariff
2012-11-01 13:42:21 -0400, vincent, MKTAXI-380: Mileage Rate => Kilometric Rate
2012-11-01 15:19:50 -0400, alex, Added Taxiworld configuration
2012-11-01 15:05:17 -0400, alex, Release Android 1.1.19
2012-11-01 13:39:18 -0400, vincent, Fixed bug when tariff starts and end at midnight
2012-11-01 12:01:50 -0400, vincent, MKTAXI-380: Refresh Fare Estimate when changing pickup date [iOS]
2012-11-01 11:12:50 -0400, matthieu, Add packages for mobiel service
2012-11-01 10:31:55 -0400, matthieu, add upload of file
2012-11-01 09:49:36 -0400, vincent, fixed build
2012-11-01 09:25:06 -0400, vincent, Merge
2012-11-01 09:23:55 -0400, vincent, Added missing file in csproj
2012-11-01 09:22:28 -0400, vincent, Merge
2012-11-01 09:22:19 -0400, vincent, Added confirmation before deleting Tariff
2012-11-01 09:24:03 -0400, matthieu, downgrade android version :  2.2 level API 8
2012-11-01 09:20:18 -0400, matthieu, remove staging and add configuration for relaease
2012-11-01 09:12:24 -0400, matthieu, add filter only job for server-side
2012-11-01 08:32:51 -0400, alex, Close Hot Fix GPS Accuracy branch
2012-11-01 08:30:40 -0400, alex, Fix merge issues
2012-11-01 08:23:02 -0400, alex, Merge with Hot Fix GPS Accuracy
2012-11-01 08:19:17 -0400, alex, Merge with Hot Fix GPS Accuracy
2012-11-01 08:17:55 -0400, alex, Corrections to the GPS accuracy.  Implemented 2 try algo
2012-10-31 17:48:42 -0400, vincent, Merge
2012-10-31 17:48:03 -0400, vincent, made application compile in iOS
2012-10-31 17:32:58 -0400, vincent, Made Tariffs work in Android
2012-10-31 16:48:07 -0400, vincent, Fixed bug with RatingScoreDetails
Added missing files in csproj
2012-10-31 16:36:23 -0400, vincent, Merge with default
2012-10-31 16:35:32 -0400, vincent, Renamed Rate to Tariff (server side)
2012-10-31 15:37:27 -0400, vincent, Renamed Rate to Tariff (client side)
2012-10-31 15:15:32 -0400, vincent, Send date to direction service in order to get correct rate
2012-10-31 14:36:35 -0400, vincent, Fixed some tests
2012-10-31 13:50:36 -0400, vincent, Fixed some unit tests
Prevent from deleting default rate
2012-10-31 16:59:19 -0400, matthieu, begin on upload of ipa by c# code
2012-10-31 16:27:42 -0400, Maxime, MKTAXI-469 : [Server] Rate order command and api + get rate by order id
2012-10-31 14:12:08 -0400, Maxime, Merge with default
2012-10-31 14:09:04 -0400, Maxime, MKTAXI-373 : Rating Types Commands
2012-10-31 14:04:37 -0400, Florent, Merge
2012-10-31 14:04:02 -0400, Florent, fix compilation
2012-10-31 14:03:52 -0400, Florent, MKT-469 : Begin of rate order command
2012-10-31 14:03:26 -0400, matthieu, fix missing files and webconfig transformation
2012-10-31 12:19:43 -0400, vincent, Default rate creation in database initializer
2012-10-31 11:53:22 -0400, vincent, Merge with default
2012-10-31 11:40:39 -0400, matthieu, add import of settings
2012-10-31 10:45:45 -0400, Maxime, Merge
2012-10-31 10:41:36 -0400, Maxime, MKTAXI-434 : Added possibility to get ReferenceData without filtering
2012-10-31 10:33:20 -0400, vincent, js refactoring
2012-10-30 18:04:28 -0400, vincent, Merge
2012-10-30 17:38:26 -0400, vincent, Added error handling in Admin interface
2012-10-31 09:56:03 -0400, matthieu, Deployment Mobile : separation customization of Build
2012-10-31 09:50:07 -0400, matthieu, Build android and iOS project from mobile deployment tool
2012-10-30 17:26:12 -0400, matthieu, modify build tool to call the mdtool
2012-10-30 17:28:56 -0400, Florent, Merge
2012-10-30 17:22:51 -0400, Florent, fix localization
2012-10-30 17:20:56 -0400, Florent, fix design issue
2012-10-30 17:07:18 -0400, Florent, MKTAXI-465 : modify design of administration interface for update settings page
2012-10-30 17:06:26 -0400, vincent, Save and retrieve excluded ibs items in Web Admin
2012-10-30 15:54:05 -0400, vincent, Fixed merge issues
2012-10-30 15:45:05 -0400, vincent, Merge
2012-10-30 15:38:31 -0400, vincent, MKTAXI-434: Started creation of Admin interface to exclude IBS list items
2012-10-30 13:55:49 -0400, vincent, MKTAXI-467: fixed unit test
2012-10-30 15:28:43 -0400, Florent, fix administration website error
2012-10-30 15:17:12 -0400, Florent, Merge
2012-10-30 15:12:28 -0400, Florent, -fix bug warning and error on android
-MKT-449 : add settings to event sourcing ( company aggregate ) + test + api change
-MKT-465 : display list of settings in administration and can save
2012-10-30 15:15:49 -0400, matthieu, modify build script to pass argument to it
2012-10-30 15:00:34 -0400, matthieu, modify build script to pass argument to it
2012-10-30 14:25:00 -0400, matthieu, move config tool in the deployment service
2012-10-30 13:45:57 -0400, vincent, MKTAXI-467: Deleted order should not be removed from read model
2012-10-30 08:45:15 -0400, matthieu, remove compilation directive
2012-10-30 00:06:42 -0400, vincent, RAteProvider implementation for Android
2012-10-29 23:31:00 -0400, vincent, Create Default rate in Database Initializer
2012-10-29 22:36:48 -0400, vincent, Create RateCalculator with unit tests
2012-10-29 15:45:26 -0400, vincent, Merge with MKTAXI-380
2012-10-29 15:44:56 -0400, vincent, Fixed some whitespace after merge
2012-10-29 15:40:07 -0400, vincent, Merge with default
2012-10-29 15:36:58 -0400, vincent, EditRate form localization and validation
2012-10-29 16:52:23 -0400, matthieu, Add mobile service with mono to build app
2012-10-29 13:28:09 -0400, vincent, Added DatePicker for RateType=Day Rate
Added PUT support
2012-10-29 12:57:45 -0400, Florent, fix compilation error
2012-10-29 11:55:26 -0400, Florent, Merge
2012-10-29 11:51:25 -0400, Florent, MKT-449 : Add settinsg to company domain
2012-10-29 09:44:59 -0400, matthieu, remove key store generation from config tool, fusion settings and appinfo in the same file
2012-10-29 08:16:50 -0400, matthieu, add key store and google map generation to config tool
2012-10-26 18:54:47 -0400, vincent, Display startTime and endTime when editing rate
2012-10-26 18:06:35 -0400, vincent, Merge with default
2012-10-26 18:05:50 -0400, vincent, Edit Rate screen (wip)
2012-10-26 17:29:07 -0400, alex, Close Hot fixMKTAXI-464 branch
2012-10-26 17:28:29 -0400, alex, Merge with Hot fixMKTAXI-464
2012-10-26 17:25:53 -0400, alex, Merge with Hot fixMKTAXI-464
2012-10-26 17:24:43 -0400, alex, Hot Fix MKTAXI-464
2012-10-26 17:15:51 -0400, alex, Backed out changeset: a76b7283c7c1
2012-10-26 17:12:42 -0400, alex, MKTAXI-464
2012-10-26 14:46:30 -0400, alex, Merge with Hot Fix-2
2012-10-26 16:44:13 -0400, vincent, Delete Rate
2012-10-26 15:32:15 -0400, vincent, Added Rate Name required property
Added server side validation
2012-10-26 13:57:47 -0400, vincent, Merge with default
2012-10-26 13:57:24 -0400, vincent, Adde timepickers for startTime and endTime
2012-10-26 09:29:00 -0400, vincent, Merge with default
2012-10-26 10:38:44 -0400, matthieu, Fix issue with url scheme when publish to App Store
